{
  "schemaVersion": 1,
  "name": "project-toolkit",
  "namespace": "dotknewt",
  "version": "0.1.0",
  "description": "Project workflow instructions for handling TODO and backlog items.",
  "license": "MIT",
  "exports": [
    {
      "kind": "skill",
      "source": "skills/dotknewt-handling-todos",
      "destination": "skills/dotknewt-handling-todos"
    }
  ],
  "requiredSkills": ["dotknewt-handling-todos"],
  "mcp": [],
  "dependencies": { "platforms": ["linux"], "executables": [] }
}
